
*** Running vivado
    with args -log top.vdi -applog -m64 -product Vivado -messageDb vivado.pb -mode batch -source top.tcl -notrace



****** Vivado v2020.1 (64-bit)
  **** SW Build 2902540 on Wed May 27 19:54:49 MDT 2020
  **** IP Build 2902112 on Wed May 27 22:43:36 MDT 2020
    ** Copyright 1986-2020 Xilinx, Inc. All Rights Reserved.

source top.tcl -notrace
Command: link_design -top top -part xc7a50ticsg324-1L
Design is defaulting to srcset: sources_1
Design is defaulting to constrset: constrs_1
INFO: [Device 21-403] Loading part xc7a50ticsg324-1L
Netlist sorting complete. Time (s): cpu = 00:00:00 ; elapsed = 00:00:00.001 . Memory (MB): peak = 1020.574 ; gain = 0.000
INFO: [Netlist 29-17] Analyzing 9 Unisim elements for replacement
INFO: [Netlist 29-28] Unisim Transformation completed in 0 CPU seconds
INFO: [Project 1-479] Netlist was created with Vivado 2020.1
INFO: [Project 1-570] Preparing netlist for logic optimization
Parsing XDC File [D:/Documents/vecera 230345/digital-electronics-1/labs/08-traffic_lights/traffic.srcs/constrs_1/new/nexys-a7-50T.xdc]
Finished Parsing XDC File [D:/Documents/vecera 230345/digital-electronics-1/labs/08-traffic_lights/traffic.srcs/constrs_1/new/nexys-a7-50T.xdc]
INFO: [Opt 31-138] Pushed 0 inverter(s) to 0 load pin(s).
Netlist sorting complete. Time (s): cpu = 00:00:00 ; elapsed = 00:00:00.001 . Memory (MB): peak = 1020.574 ; gain = 0.000
INFO: [Project 1-111] Unisim Transformation Summary:
No Unisim elements were transformed.

7 Infos, 0 Warnings, 0 Critical Warnings and 0 Errors encountered.
link_design completed successfully
link_design: Time (s): cpu = 00:00:05 ; elapsed = 00:00:06 . Memory (MB): peak = 1020.574 ; gain = 0.000
Command: opt_design
Attempting to get a license for feature 'Implementation' and/or device 'xc7a50ti'
INFO: [Common 17-349] Got license for feature 'Implementation' and/or device 'xc7a50ti'
Running DRC as a precondition to command opt_design

Starting DRC Task
INFO: [DRC 23-27] Running DRC with 2 threads
INFO: [Project 1-461] DRC finished with 0 Errors
INFO: [Project 1-462] Please refer to the DRC report (report_drc) for more information.

Time (s): cpu = 00:00:02 ; elapsed = 00:00:00.816 . Memory (MB): peak = 1020.574 ; gain = 0.000

Starting Cache Timing Information Task

*** Running vivado
    with args -log top.vdi -applog -m64 -product Vivado -messageDb vivado.pb -mode batch -source top.tcl -notrace



****** Vivado v2020.1 (64-bit)
  **** SW Build 2902540 on Wed May 27 19:54:49 MDT 2020
  **** IP Build 2902112 on Wed May 27 22:43:36 MDT 2020
    ** Copyright 1986-2020 Xilinx, Inc. All Rights Reserved.

source top.tcl -notrace
Command: link_design -top top -part xc7a50ticsg324-1L
Design is defaulting to srcset: sources_1
Design is defaulting to constrset: constrs_1
INFO: [Device 21-403] Loading part xc7a50ticsg324-1L
Netlist sorting complete. Time (s): cpu = 00:00:00 ; elapsed = 00:00:00.001 . Memory (MB): peak = 1020.391 ; gain = 0.000
INFO: [Netlist 29-17] Analyzing 9 Unisim elements for replacement
INFO: [Netlist 29-28] Unisim Transformation completed in 0 CPU seconds
INFO: [Project 1-479] Netlist was created with Vivado 2020.1
INFO: [Project 1-570] Preparing netlist for logic optimization
Parsing XDC File [D:/Documents/vecera 230345/digital-electronics-1/labs/08-traffic_lights/traffic.srcs/constrs_1/new/nexys-a7-50T.xdc]
Finished Parsing XDC File [D:/Documents/vecera 230345/digital-electronics-1/labs/08-traffic_lights/traffic.srcs/constrs_1/new/nexys-a7-50T.xdc]
INFO: [Opt 31-138] Pushed 0 inverter(s) to 0 load pin(s).
Netlist sorting complete. Time (s): cpu = 00:00:00 ; elapsed = 00:00:00 . Memory (MB): peak = 1020.391 ; gain = 0.000
INFO: [Project 1-111] Unisim Transformation Summary:
No Unisim elements were transformed.

7 Infos, 0 Warnings, 0 Critical Warnings and 0 Errors encountered.
link_design completed successfully
link_design: Time (s): cpu = 00:00:05 ; elapsed = 00:00:06 . Memory (MB): peak = 1020.391 ; gain = 0.000
Command: opt_design
Attempting to get a license for feature 'Implementation' and/or device 'xc7a50ti'
INFO: [Common 17-349] Got license for feature 'Implementation' and/or device 'xc7a50ti'
Running DRC as a precondition to command opt_design

Starting DRC Task
INFO: [DRC 23-27] Running DRC with 2 threads
INFO: [Project 1-461] DRC finished with 0 Errors
INFO: [Project 1-462] Please refer to the DRC report (report_drc) for more information.

Time (s): cpu = 00:00:02 ; elapsed = 00:00:00.788 . Memory (MB): peak = 1020.391 ; gain = 0.000

Starting Cache Timing Information Task
INFO: [Timing 38-35] Done setting XDC timing constraints.
Ending Cache Timing Information Task | Checksum: 178157a75

Time (s): cpu = 00:00:07 ; elapsed = 00:00:08 . Memory (MB): peak = 1270.629 ; gain = 250.238

Starting Logic Optimization Task

Phase 1 Retarget
INFO: [Opt 31-138] Pushed 0 inverter(s) to 0 load pin(s).
INFO: [Opt 31-49] Retargeted 0 cell(s).
Phase 1 Retarget | Checksum: 178157a75

Time (s): cpu = 00:00:00 ; elapsed = 00:00:00.013 . Memory (MB): peak = 1474.695 ; gain = 0.000
INFO: [Opt 31-389] Phase Retarget created 0 cells and removed 0 cells

Phase 2 Constant propagation
INFO: [Opt 31-138] Pushed 0 inverter(s) to 0 load pin(s).
Phase 2 Constant propagation | Checksum: 178157a75

Time (s): cpu = 00:00:00 ; elapsed = 00:00:00.014 . Memory (MB): peak = 1474.695 ; gain = 0.000
INFO: [Opt 31-389] Phase Constant propagation created 0 cells and removed 0 cells

Phase 3 Sweep
Phase 3 Sweep | Checksum: 1ee034d8f

Time (s): cpu = 00:00:00 ; elapsed = 00:00:00.019 . Memory (MB): peak = 1474.695 ; gain = 0.000
INFO: [Opt 31-389] Phase Sweep created 0 cells and removed 0 cells

Phase 4 BUFG optimization
Phase 4 BUFG optimization | Checksum: 1ee034d8f

Time (s): cpu = 00:00:00 ; elapsed = 00:00:00.021 . Memory (MB): peak = 1474.695 ; gain = 0.000
INFO: [Opt 31-662] Phase BUFG optimization created 0 cells of which 0 are BUFGs and removed 0 cells.

Phase 5 Shift Register Optimization
INFO: [Opt 31-1064] SRL Remap converted 0 SRLs to 0 registers and converted 0 registers of register chains to 0 SRLs
Phase 5 Shift Register Optimization | Checksum: 1ee034d8f

Time (s): cpu = 00:00:00 ; elapsed = 00:00:00.022 . Memory (MB): peak = 1474.695 ; gain = 0.000
INFO: [Opt 31-389] Phase Shift Register Optimization created 0 cells and removed 0 cells

Phase 6 Post Processing Netlist
Phase 6 Post Processing Netlist | Checksum: 1ee034d8f

Time (s): cpu = 00:00:00 ; elapsed = 00:00:00.023 . Memory (MB): peak = 1474.695 ; gain = 0.000
INFO: [Opt 31-389] Phase Post Processing Netlist created 0 cells and removed 0 cells
Opt_design Change Summary
=========================


-------------------------------------------------------------------------------------------------------------------------
|  Phase                        |  #Cells created  |  #Cells Removed  |  #Constrained objects preventing optimizations  |
-------------------------------------------------------------------------------------------------------------------------
|  Retarget                     |               0  |               0  |                                              0  |
|  Constant propagation         |               0  |               0  |                                              0  |
|  Sweep                        |               0  |               0  |                                              0  |
|  BUFG optimization            |               0  |               0  |                                              0  |
|  Shift Register Optimization  |               0  |               0  |                                              0  |
|  Post Processing Netlist      |               0  |               0  |                                              0  |
-------------------------------------------------------------------------------------------------------------------------



Starting Connectivity Check Task

Time (s): cpu = 00:00:00 ; elapsed = 00:00:00 . Memory (MB): peak = 1474.695 ; gain = 0.000
Ending Logic Optimization Task | Checksum: 12ba3b51e

Time (s): cpu = 00:00:00 ; elapsed = 00:00:00.029 . Memory (MB): peak = 1474.695 ; gain = 0.000

Starting Power Optimization Task
INFO: [Pwropt 34-132] Skipping clock gating for clocks with a period < 2.00 ns.
Ending Power Optimization Task | Checksum: 12ba3b51e

Time (s): cpu = 00:00:00 ; elapsed = 00:00:00.006 . Memory (MB): peak = 1474.695 ; gain = 0.000

Starting Final Cleanup Task
Ending Final Cleanup Task | Checksum: 12ba3b51e

Time (s): cpu = 00:00:00 ; elapsed = 00:00:00 . Memory (MB): peak = 1474.695 ; gain = 0.000

Starting Netlist Obfuscation Task
Netlist sorting complete. Time (s): cpu = 00:00:00 ; elapsed = 00:00:00 . Memory (MB): peak = 1474.695 ; gain = 0.000
Ending Netlist Obfuscation Task | Checksum: 12ba3b51e

Time (s): cpu = 00:00:00 ; elapsed = 00:00:00 . Memory (MB): peak = 1474.695 ; gain = 0.000
INFO: [Common 17-83] Releasing license: Implementation
24 Infos, 0 Warnings, 0 Critical Warnings and 0 Errors encountered.
opt_design completed successfully
opt_design: Time (s): cpu = 00:00:11 ; elapsed = 00:00:11 . Memory (MB): peak = 1474.695 ; gain = 454.305
INFO: [Timing 38-480] Writing timing data to binary archive.
Writing placer database...
Writing XDEF routing.
Writing XDEF routing logical nets.
Writing XDEF routing special nets.
Write XDEF Complete: Time (s): cpu = 00:00:00 ; elapsed = 00:00:00.026 . Memory (MB): peak = 1474.695 ; gain = 0.000
INFO: [Common 17-1381] The checkpoint 'D:/Documents/vecera 230345/digital-electronics-1/labs/08-traffic_lights/traffic.runs/impl_1/top_opt.dcp' has been generated.
INFO: [runtcl-4] Executing : report_drc -file top_drc_opted.rpt -pb top_drc_opted.pb -rpx top_drc_opted.rpx
Command: report_drc -file top_drc_opted.rpt -pb top_drc_opted.pb -rpx top_drc_opted.rpx
INFO: [IP_Flow 19-234] Refreshing IP repositories
INFO: [IP_Flow 19-1704] No user IP repositories specified
INFO: [IP_Flow 19-2313] Loaded Vivado IP repository 'C:/APPZ/Xilinx/Vivado/2020.1/data/ip'.
INFO: [DRC 23-27] Running DRC with 2 threads
INFO: [Coretcl 2-168] The results of DRC are in file D:/Documents/vecera 230345/digital-electronics-1/labs/08-traffic_lights/traffic.runs/impl_1/top_drc_opted.rpt.
report_drc completed successfully
Command: place_design
Attempting to get a license for feature 'Implementation' and/or device 'xc7a50ti'
INFO: [Common 17-349] Got license for feature 'Implementation' and/or device 'xc7a50ti'
INFO: [DRC 23-27] Running DRC with 2 threads
INFO: [Vivado_Tcl 4-198] DRC finished with 0 Errors
INFO: [Vivado_Tcl 4-199] Please refer to the DRC report (report_drc) for more information.
Running DRC as a precondition to command place_design
INFO: [DRC 23-27] Running DRC with 2 threads
INFO: [Vivado_Tcl 4-198] DRC finished with 0 Errors
INFO: [Vivado_Tcl 4-199] Please refer to the DRC report (report_drc) for more information.

Starting Placer Task
INFO: [Place 30-611] Multithreading enabled for place_design using a maximum of 2 CPUs

Phase 1 Placer Initialization

Phase 1.1 Placer Initialization Netlist Sorting
Netlist sorting complete. Time (s): cpu = 00:00:00 ; elapsed = 00:00:00 . Memory (MB): peak = 1474.695 ; gain = 0.000
Phase 1.1 Placer Initialization Netlist Sorting | Checksum: a6a101c8

Time (s): cpu = 00:00:00 ; elapsed = 00:00:00.005 . Memory (MB): peak = 1474.695 ; gain = 0.000
Netlist sorting complete. Time (s): cpu = 00:00:00 ; elapsed = 00:00:00 . Memory (MB): peak = 1474.695 ; gain = 0.000

Phase 1.2 IO Placement/ Clock Placement/ Build Placer Device
INFO: [Timing 38-35] Done setting XDC timing constraints.
Phase 1.2 IO Placement/ Clock Placement/ Build Placer Device | Checksum: 9772d051

Time (s): cpu = 00:00:01 ; elapsed = 00:00:00.404 . Memory (MB): peak = 1474.695 ; gain = 0.000

Phase 1.3 Build Placer Netlist Model
Phase 1.3 Build Placer Netlist Model | Checksum: 17764b04f

Time (s): cpu = 00:00:01 ; elapsed = 00:00:00.477 . Memory (MB): peak = 1474.695 ; gain = 0.000

Phase 1.4 Constrain Clocks/Macros
Phase 1.4 Constrain Clocks/Macros | Checksum: 17764b04f

Time (s): cpu = 00:00:01 ; elapsed = 00:00:00.478 . Memory (MB): peak = 1474.695 ; gain = 0.000
Phase 1 Placer Initialization | Checksum: 17764b04f

Time (s): cpu = 00:00:01 ; elapsed = 00:00:00.481 . Memory (MB): peak = 1474.695 ; gain = 0.000

Phase 2 Global Placement

Phase 2.1 Floorplanning
Phase 2.1 Floorplanning | Checksum: e285ed1c

Time (s): cpu = 00:00:01 ; elapsed = 00:00:00.531 . Memory (MB): peak = 1474.695 ; gain = 0.000

Phase 2.2 Global Placement Core

Phase 2.2.1 Physical Synthesis In Placer
INFO: [Physopt 32-1044] Break lutnm for timing: one critical 0, two critical 0, total 0, new lutff created 0
INFO: [Physopt 32-775] End 1 Pass. Optimized 0 net or cell. Created 0 new cell, deleted 0 existing cell and moved 0 existing cell
INFO: [Physopt 32-65] No nets found for high-fanout optimization.
INFO: [Physopt 32-232] Optimized 0 net. Created 0 new instance.
INFO: [Physopt 32-775] End 1 Pass. Optimized 0 net or cell. Created 0 new cell, deleted 0 existing cell and moved 0 existing cell
INFO: [Physopt 32-670] No setup violation found.  DSP Register Optimization was not performed.
INFO: [Physopt 32-670] No setup violation found.  Shift Register to Pipeline Optimization was not performed.
INFO: [Physopt 32-670] No setup violation found.  Shift Register Optimization was not performed.
INFO: [Physopt 32-670] No setup violation found.  BRAM Register Optimization was not performed.
INFO: [Physopt 32-670] No setup violation found.  URAM Register Optimization was not performed.
INFO: [Physopt 32-949] No candidate nets found for HD net replication
INFO: [Physopt 32-775] End 1 Pass. Optimized 0 net or cell. Created 0 new cell, deleted 0 existing cell and moved 0 existing cell
Netlist sorting complete. Time (s): cpu = 00:00:00 ; elapsed = 00:00:00 . Memory (MB): peak = 1474.695 ; gain = 0.000

Summary of Physical Synthesis Optimizations
============================================


-----------------------------------------------------------------------------------------------------------------------------------------------------------
|  Optimization                                     |  Added Cells  |  Removed Cells  |  Optimized Cells/Nets  |  Dont Touch  |  Iterations  |  Elapsed   |
-----------------------------------------------------------------------------------------------------------------------------------------------------------
|  LUT Combining                                    |            0  |              0  |                     0  |           0  |           1  |  00:00:00  |
|  Very High Fanout                                 |            0  |              0  |                     0  |           0  |           1  |  00:00:00  |
|  DSP Register                                     |            0  |              0  |                     0  |           0  |           0  |  00:00:00  |
|  Shift Register to Pipeline                       |            0  |              0  |                     0  |           0  |           0  |  00:00:00  |
|  Shift Register                                   |            0  |              0  |                     0  |           0  |           0  |  00:00:00  |
|  BRAM Register                                    |            0  |              0  |                     0  |           0  |           0  |  00:00:00  |
|  URAM Register                                    |            0  |              0  |                     0  |           0  |           0  |  00:00:00  |
|  Dynamic/Static Region Interface Net Replication  |            0  |              0  |                     0  |           0  |           1  |  00:00:00  |
|  Total                                            |            0  |              0  |                     0  |           0  |           3  |  00:00:00  |
-----------------------------------------------------------------------------------------------------------------------------------------------------------


Phase 2.2.1 Physical Synthesis In Placer | Checksum: 15cb0e998

Time (s): cpu = 00:00:02 ; elapsed = 00:00:00.990 . Memory (MB): peak = 1474.695 ; gain = 0.000
Phase 2.2 Global Placement Core | Checksum: 16d3ac2bc

Time (s): cpu = 00:00:02 ; elapsed = 00:00:01 . Memory (MB): peak = 1474.695 ; gain = 0.000
Phase 2 Global Placement | Checksum: 16d3ac2bc

Time (s): cpu = 00:00:02 ; elapsed = 00:00:01 . Memory (MB): peak = 1474.695 ; gain = 0.000

Phase 3 Detail Placement

Phase 3.1 Commit Multi Column Macros
Phase 3.1 Commit Multi Column Macros | Checksum: 194f0bf97

Time (s): cpu = 00:00:02 ; elapsed = 00:00:01 . Memory (MB): peak = 1474.695 ; gain = 0.000

Phase 3.2 Commit Most Macros & LUTRAMs
Phase 3.2 Commit Most Macros & LUTRAMs | Checksum: 18a97e0b9

Time (s): cpu = 00:00:02 ; elapsed = 00:00:01 . Memory (MB): peak = 1474.695 ; gain = 0.000

Phase 3.3 Area Swap Optimization
Phase 3.3 Area Swap Optimization | Checksum: 183dd030f

Time (s): cpu = 00:00:02 ; elapsed = 00:00:01 . Memory (MB): peak = 1474.695 ; gain = 0.000

Phase 3.4 Pipeline Register Optimization
Phase 3.4 Pipeline Register Optimization | Checksum: 183dd030f

Time (s): cpu = 00:00:02 ; elapsed = 00:00:01 . Memory (MB): peak = 1474.695 ; gain = 0.000

Phase 3.5 Small Shape Detail Placement
Phase 3.5 Small Shape Detail Placement | Checksum: 20197e586

Time (s): cpu = 00:00:02 ; elapsed = 00:00:01 . Memory (MB): peak = 1474.695 ; gain = 0.000

Phase 3.6 Re-assign LUT pins
Phase 3.6 Re-assign LUT pins | Checksum: 16bc44949

Time (s): cpu = 00:00:02 ; elapsed = 00:00:01 . Memory (MB): peak = 1474.695 ; gain = 0.000

Phase 3.7 Pipeline Register Optimization
Phase 3.7 Pipeline Register Optimization | Checksum: 16bc44949

Time (s): cpu = 00:00:02 ; elapsed = 00:00:01 . Memory (MB): peak = 1474.695 ; gain = 0.000
Phase 3 Detail Placement | Checksum: 16bc44949

Time (s): cpu = 00:00:02 ; elapsed = 00:00:01 . Memory (MB): peak = 1474.695 ; gain = 0.000

Phase 4 Post Placement Optimization and Clean-Up

Phase 4.1 Post Commit Optimization
INFO: [Timing 38-35] Done setting XDC timing constraints.

Phase 4.1.1 Post Placement Optimization
Post Placement Optimization Initialization | Checksum: be153d6e

Phase 4.1.1.1 BUFG Insertion

Starting Physical Synthesis Task

Phase 1 Physical Synthesis Initialization
INFO: [Physopt 32-721] Multithreading enabled for phys_opt_design using a maximum of 2 CPUs
INFO: [Physopt 32-619] Estimated Timing Summary | WNS=5.613 | TNS=0.000 |
Phase 1 Physical Synthesis Initialization | Checksum: eb0b8702

Time (s): cpu = 00:00:00 ; elapsed = 00:00:00.013 . Memory (MB): peak = 1485.500 ; gain = 0.000
INFO: [Place 46-56] BUFG insertion identified 0 candidate nets. Inserted BUFG: 0, Replicated BUFG Driver: 0, Skipped due to Placement/Routing Conflicts: 0, Skipped due to Timing Degradation: 0, Skipped due to Illegal Netlist: 0.
Ending Physical Synthesis Task | Checksum: 10e1af2f2

Time (s): cpu = 00:00:00 ; elapsed = 00:00:00.014 . Memory (MB): peak = 1485.500 ; gain = 0.000
Phase 4.1.1.1 BUFG Insertion | Checksum: be153d6e

Time (s): cpu = 00:00:02 ; elapsed = 00:00:01 . Memory (MB): peak = 1485.500 ; gain = 10.805
INFO: [Place 30-746] Post Placement Timing Summary WNS=5.613. For the most accurate timing information please run report_timing.
Phase 4.1.1 Post Placement Optimization | Checksum: ddfa8b68

Time (s): cpu = 00:00:02 ; elapsed = 00:00:01 . Memory (MB): peak = 1485.500 ; gain = 10.805
Phase 4.1 Post Commit Optimization | Checksum: ddfa8b68

Time (s): cpu = 00:00:02 ; elapsed = 00:00:01 . Memory (MB): peak = 1485.500 ; gain = 10.805

Phase 4.2 Post Placement Cleanup
Phase 4.2 Post Placement Cleanup | Checksum: ddfa8b68

Time (s): cpu = 00:00:02 ; elapsed = 00:00:01 . Memory (MB): peak = 1485.500 ; gain = 10.805

Phase 4.3 Placer Reporting
Phase 4.3 Placer Reporting | Checksum: ddfa8b68

Time (s): cpu = 00:00:02 ; elapsed = 00:00:01 . Memory (MB): peak = 1485.500 ; gain = 10.805

Phase 4.4 Final Placement Cleanup
Netlist sorting complete. Time (s): cpu = 00:00:00 ; elapsed = 00:00:00 . Memory (MB): peak = 1485.500 ; gain = 0.000
Phase 4.4 Final Placement Cleanup | Checksum: 13a1df7fd

Time (s): cpu = 00:00:02 ; elapsed = 00:00:01 . Memory (MB): peak = 1485.500 ; gain = 10.805
Phase 4 Post Placement Optimization and Clean-Up | Checksum: 13a1df7fd

Time (s): cpu = 00:00:02 ; elapsed = 00:00:01 . Memory (MB): peak = 1485.500 ; gain = 10.805
Ending Placer Task | Checksum: e53bac31

Time (s): cpu = 00:00:02 ; elapsed = 00:00:01 . Memory (MB): peak = 1485.500 ; gain = 10.805
INFO: [Common 17-83] Releasing license: Implementation
59 Infos, 0 Warnings, 0 Critical Warnings and 0 Errors encountered.
place_design completed successfully
INFO: [Timing 38-480] Writing timing data to binary archive.
Writing placer database...
Writing XDEF routing.
Writing XDEF routing logical nets.
Writing XDEF routing special nets.
Write XDEF Complete: Time (s): cpu = 00:00:00 ; elapsed = 00:00:00.032 . Memory (MB): peak = 1485.617 ; gain = 0.117
INFO: [Common 17-1381] The checkpoint 'D:/Documents/vecera 230345/digital-electronics-1/labs/08-traffic_lights/traffic.runs/impl_1/top_placed.dcp' has been generated.
INFO: [runtcl-4] Executing : report_io -file top_io_placed.rpt
report_io: Time (s): cpu = 00:00:00 ; elapsed = 00:00:00.032 . Memory (MB): peak = 1485.617 ; gain = 0.000
INFO: [runtcl-4] Executing : report_utilization -file top_utilization_placed.rpt -pb top_utilization_placed.pb
INFO: [runtcl-4] Executing : report_control_sets -verbose -file top_control_sets_placed.rpt
report_control_sets: Time (s): cpu = 00:00:00 ; elapsed = 00:00:00.001 . Memory (MB): peak = 1485.617 ; gain = 0.000
Command: phys_opt_design
Attempting to get a license for feature 'Implementation' and/or device 'xc7a50ti'
INFO: [Common 17-349] Got license for feature 'Implementation' and/or device 'xc7a50ti'
INFO: [Vivado_Tcl 4-383] Design worst setup slack (WNS) is greater than or equal to 0.000 ns. Skipping all physical synthesis optimizations.
INFO: [Vivado_Tcl 4-232] No setup violation found. The netlist was not modified.
INFO: [Common 17-83] Releasing license: Implementation
68 Infos, 0 Warnings, 0 Critical Warnings and 0 Errors encountered.
phys_opt_design completed successfully
INFO: [Timing 38-480] Writing timing data to binary archive.
Writing placer database...
Writing XDEF routing.
Writing XDEF routing logical nets.
Writing XDEF routing special nets.
Write XDEF Complete: Time (s): cpu = 00:00:00 ; elapsed = 00:00:00.033 . Memory (MB): peak = 1512.332 ; gain = 17.867
INFO: [Common 17-1381] The checkpoint 'D:/Documents/vecera 230345/digital-electronics-1/labs/08-traffic_lights/traffic.runs/impl_1/top_physopt.dcp' has been generated.
Command: route_design
Attempting to get a license for feature 'Implementation' and/or device 'xc7a50ti'
INFO: [Common 17-349] Got license for feature 'Implementation' and/or device 'xc7a50ti'
Running DRC as a precondition to command route_design
INFO: [DRC 23-27] Running DRC with 2 threads
INFO: [Vivado_Tcl 4-198] DRC finished with 0 Errors
INFO: [Vivado_Tcl 4-199] Please refer to the DRC report (report_drc) for more information.


Starting Routing Task
INFO: [Route 35-254] Multithreading enabled for route_design using a maximum of 2 CPUs
Checksum: PlaceDB: 580c69c2 ConstDB: 0 ShapeSum: 8d2f426f RouteDB: 0

Phase 1 Build RT Design
Phase 1 Build RT Design | Checksum: a0eca7f1

Time (s): cpu = 00:00:16 ; elapsed = 00:00:14 . Memory (MB): peak = 1592.809 ; gain = 70.367
Post Restoration Checksum: NetGraph: 808c5f3 NumContArr: 98e3e1fe Constraints: 0 Timing: 0

Phase 2 Router Initialization

Phase 2.1 Create Timer
Phase 2.1 Create Timer | Checksum: a0eca7f1

Time (s): cpu = 00:00:16 ; elapsed = 00:00:14 . Memory (MB): peak = 1592.809 ; gain = 70.367

Phase 2.2 Fix Topology Constraints
Phase 2.2 Fix Topology Constraints | Checksum: a0eca7f1

Time (s): cpu = 00:00:16 ; elapsed = 00:00:14 . Memory (MB): peak = 1598.812 ; gain = 76.371

Phase 2.3 Pre Route Cleanup
Phase 2.3 Pre Route Cleanup | Checksum: a0eca7f1

Time (s): cpu = 00:00:16 ; elapsed = 00:00:14 . Memory (MB): peak = 1598.812 ; gain = 76.371
 Number of Nodes with overlaps = 0

Phase 2.4 Update Timing
Phase 2.4 Update Timing | Checksum: 13f969b40

Time (s): cpu = 00:00:16 ; elapsed = 00:00:15 . Memory (MB): peak = 1602.195 ; gain = 79.754
INFO: [Route 35-416] Intermediate Timing Summary | WNS=5.612  | TNS=0.000  | WHS=-0.094 | THS=-0.717 |

Phase 2 Router Initialization | Checksum: 1bbc77d00

Time (s): cpu = 00:00:16 ; elapsed = 00:00:15 . Memory (MB): peak = 1602.195 ; gain = 79.754

Router Utilization Summary
  Global Vertical Routing Utilization    = 0 %
  Global Horizontal Routing Utilization  = 0 %
  Routable Net Status*
  *Does not include unroutable nets such as driverless and loadless.
  Run report_route_status for detailed report.
  Number of Failed Nets               = 69
    (Failed Nets is the sum of unrouted and partially routed nets)
  Number of Unrouted Nets             = 69
  Number of Partially Routed Nets     = 0
  Number of Node Overlaps             = 0


Phase 3 Initial Routing
Phase 3 Initial Routing | Checksum: 1009411ce

Time (s): cpu = 00:00:16 ; elapsed = 00:00:15 . Memory (MB): peak = 1603.574 ; gain = 81.133

Phase 4 Rip-up And Reroute

Phase 4.1 Global Iteration 0
 Number of Nodes with overlaps = 2
 Number of Nodes with overlaps = 0
INFO: [Route 35-416] Intermediate Timing Summary | WNS=5.355  | TNS=0.000  | WHS=N/A    | THS=N/A    |

Phase 4.1 Global Iteration 0 | Checksum: 24c145032

Time (s): cpu = 00:00:16 ; elapsed = 00:00:15 . Memory (MB): peak = 1603.574 ; gain = 81.133
Phase 4 Rip-up And Reroute | Checksum: 24c145032

Time (s): cpu = 00:00:16 ; elapsed = 00:00:15 . Memory (MB): peak = 1603.574 ; gain = 81.133

Phase 5 Delay and Skew Optimization

Phase 5.1 Delay CleanUp
Phase 5.1 Delay CleanUp | Checksum: 24c145032

Time (s): cpu = 00:00:16 ; elapsed = 00:00:15 . Memory (MB): peak = 1603.574 ; gain = 81.133

Phase 5.2 Clock Skew Optimization
Phase 5.2 Clock Skew Optimization | Checksum: 24c145032

Time (s): cpu = 00:00:16 ; elapsed = 00:00:15 . Memory (MB): peak = 1603.574 ; gain = 81.133
Phase 5 Delay and Skew Optimization | Checksum: 24c145032

Time (s): cpu = 00:00:16 ; elapsed = 00:00:15 . Memory (MB): peak = 1603.574 ; gain = 81.133

Phase 6 Post Hold Fix

Phase 6.1 Hold Fix Iter

Phase 6.1.1 Update Timing
Phase 6.1.1 Update Timing | Checksum: 1bcd05cc5

Time (s): cpu = 00:00:16 ; elapsed = 00:00:15 . Memory (MB): peak = 1603.574 ; gain = 81.133
INFO: [Route 35-416] Intermediate Timing Summary | WNS=5.434  | TNS=0.000  | WHS=0.239  | THS=0.000  |

Phase 6.1 Hold Fix Iter | Checksum: 1bcd05cc5

Time (s): cpu = 00:00:16 ; elapsed = 00:00:15 . Memory (MB): peak = 1603.574 ; gain = 81.133
Phase 6 Post Hold Fix | Checksum: 1bcd05cc5

Time (s): cpu = 00:00:16 ; elapsed = 00:00:15 . Memory (MB): peak = 1603.574 ; gain = 81.133

Phase 7 Route finalize

Router Utilization Summary
  Global Vertical Routing Utilization    = 0.0102049 %
  Global Horizontal Routing Utilization  = 0.010151 %
  Routable Net Status*
  *Does not include unroutable nets such as driverless and loadless.
  Run report_route_status for detailed report.
  Number of Failed Nets               = 0
    (Failed Nets is the sum of unrouted and partially routed nets)
  Number of Unrouted Nets             = 0
  Number of Partially Routed Nets     = 0
  Number of Node Overlaps             = 0

Phase 7 Route finalize | Checksum: 1bcd05cc5

Time (s): cpu = 00:00:16 ; elapsed = 00:00:15 . Memory (MB): peak = 1603.574 ; gain = 81.133

Phase 8 Verifying routed nets

 Verification completed successfully
Phase 8 Verifying routed nets | Checksum: 1bcd05cc5

Time (s): cpu = 00:00:16 ; elapsed = 00:00:15 . Memory (MB): peak = 1605.633 ; gain = 83.191

Phase 9 Depositing Routes
Phase 9 Depositing Routes | Checksum: 1428f9a0f

Time (s): cpu = 00:00:16 ; elapsed = 00:00:15 . Memory (MB): peak = 1605.633 ; gain = 83.191

Phase 10 Post Router Timing
INFO: [Route 35-57] Estimated Timing Summary | WNS=5.434  | TNS=0.000  | WHS=0.239  | THS=0.000  |

INFO: [Route 35-327] The final timing numbers are based on the router estimated timing analysis. For a complete and accurate timing signoff, please run report_timing_summary.
Phase 10 Post Router Timing | Checksum: 1428f9a0f

Time (s): cpu = 00:00:16 ; elapsed = 00:00:15 . Memory (MB): peak = 1605.633 ; gain = 83.191
INFO: [Route 35-16] Router Completed Successfully

Time (s): cpu = 00:00:16 ; elapsed = 00:00:15 . Memory (MB): peak = 1605.633 ; gain = 83.191

Routing Is Done.
INFO: [Common 17-83] Releasing license: Implementation
82 Infos, 0 Warnings, 0 Critical Warnings and 0 Errors encountered.
route_design completed successfully
route_design: Time (s): cpu = 00:00:17 ; elapsed = 00:00:15 . Memory (MB): peak = 1605.633 ; gain = 93.301
INFO: [Timing 38-480] Writing timing data to binary archive.
Writing placer database...
Writing XDEF routing.
Writing XDEF routing logical nets.
Writing XDEF routing special nets.
Write XDEF Complete: Time (s): cpu = 00:00:00 ; elapsed = 00:00:00.035 . Memory (MB): peak = 1615.473 ; gain = 9.840
INFO: [Common 17-1381] The checkpoint 'D:/Documents/vecera 230345/digital-electronics-1/labs/08-traffic_lights/traffic.runs/impl_1/top_routed.dcp' has been generated.
INFO: [runtcl-4] Executing : report_drc -file top_drc_routed.rpt -pb top_drc_routed.pb -rpx top_drc_routed.rpx
Command: report_drc -file top_drc_routed.rpt -pb top_drc_routed.pb -rpx top_drc_routed.rpx
INFO: [IP_Flow 19-1839] IP Catalog is up to date.
INFO: [DRC 23-27] Running DRC with 2 threads
INFO: [Coretcl 2-168] The results of DRC are in file D:/Documents/vecera 230345/digital-electronics-1/labs/08-traffic_lights/traffic.runs/impl_1/top_drc_routed.rpt.
report_drc completed successfully
INFO: [runtcl-4] Executing : report_methodology -file top_methodology_drc_routed.rpt -pb top_methodology_drc_routed.pb -rpx top_methodology_drc_routed.rpx
Command: report_methodology -file top_methodology_drc_routed.rpt -pb top_methodology_drc_routed.pb -rpx top_methodology_drc_routed.rpx
INFO: [Timing 38-35] Done setting XDC timing constraints.
INFO: [DRC 23-133] Running Methodology with 2 threads
INFO: [Coretcl 2-1520] The results of Report Methodology are in file D:/Documents/vecera 230345/digital-electronics-1/labs/08-traffic_lights/traffic.runs/impl_1/top_methodology_drc_routed.rpt.
report_methodology completed successfully
INFO: [runtcl-4] Executing : report_power -file top_power_routed.rpt -pb top_power_summary_routed.pb -rpx top_power_routed.rpx
Command: report_power -file top_power_routed.rpt -pb top_power_summary_routed.pb -rpx top_power_routed.rpx
INFO: [Timing 38-35] Done setting XDC timing constraints.
Running Vector-less Activity Propagation...

Finished Running Vector-less Activity Propagation
94 Infos, 0 Warnings, 0 Critical Warnings and 0 Errors encountered.
report_power completed successfully
INFO: [runtcl-4] Executing : report_route_status -file top_route_status.rpt -pb top_route_status.pb
INFO: [runtcl-4] Executing : report_timing_summary -max_paths 10 -file top_timing_summary_routed.rpt -pb top_timing_summary_routed.pb -rpx top_timing_summary_routed.rpx -warn_on_violation 
INFO: [Timing 38-91] UpdateTimingParams: Speed grade: -1L, Delay Type: min_max.
INFO: [Timing 38-191] Multithreading enabled for timing update using a maximum of 2 CPUs
INFO: [runtcl-4] Executing : report_incremental_reuse -file top_incremental_reuse_routed.rpt
INFO: [Vivado_Tcl 4-1062] Incremental flow is disabled. No incremental reuse Info to report.
INFO: [runtcl-4] Executing : report_clock_utilization -file top_clock_utilization_routed.rpt
INFO: [runtcl-4] Executing : report_bus_skew -warn_on_violation -file top_bus_skew_routed.rpt -pb top_bus_skew_routed.pb -rpx top_bus_skew_routed.rpx
INFO: [Timing 38-91] UpdateTimingParams: Speed grade: -1L, Delay Type: min_max.
INFO: [Timing 38-191] Multithreading enabled for timing update using a maximum of 2 CPUs
Command: write_bitstream -force top.bit
Attempting to get a license for feature 'Implementation' and/or device 'xc7a50ti'
INFO: [Common 17-349] Got license for feature 'Implementation' and/or device 'xc7a50ti'
Running DRC as a precondition to command write_bitstream
INFO: [IP_Flow 19-1839] IP Catalog is up to date.
INFO: [DRC 23-27] Running DRC with 2 threads
WARNING: [DRC CFGBVS-1] Missing CFGBVS and CONFIG_VOLTAGE Design Properties: Neither the CFGBVS nor CONFIG_VOLTAGE voltage property is set in the current_design.  Configuration bank voltage select (CFGBVS) must be set to VCCO or GND, and CONFIG_VOLTAGE must be set to the correct configuration voltage, in order to determine the I/O voltage support for the pins in bank 0.  It is suggested to specify these either using the 'Edit Device Properties' function in the GUI or directly in the XDC file using the following syntax:

 set_property CFGBVS value1 [current_design]
 #where value1 is either VCCO or GND

 set_property CONFIG_VOLTAGE value2 [current_design]
 #where value2 is the voltage provided to configuration bank 0

Refer to the device configuration user guide for more information.
INFO: [Vivado 12-3199] DRC finished with 0 Errors, 1 Warnings
INFO: [Vivado 12-3200] Please refer to the DRC report (report_drc) for more information.
INFO: [Designutils 20-2272] Running write_bitstream with 2 threads.
Loading data files...
Loading site data...
Loading route data...
Processing options...
Creating bitmap...
Creating bitstream...
Writing bitstream ./top.bit...
INFO: [Vivado 12-1842] Bitgen Completed Successfully.
INFO: [Project 1-120] WebTalk data collection is mandatory when using a WebPACK part without a full Vivado license. To see the specific WebTalk data collected for your design, open the usage_statistics_webtalk.html or usage_statistics_webtalk.xml file in the implementation directory.
Pý¡stup byl odepýen.
Pý¡stup byl odepýen.
INFO: [Common 17-83] Releasing license: Implementation
113 Infos, 1 Warnings, 0 Critical Warnings and 0 Errors encountered.
write_bitstream completed successfully
write_bitstream: Time (s): cpu = 00:00:10 ; elapsed = 00:00:09 . Memory (MB): peak = 2043.172 ; gain = 393.703
INFO: [Common 17-206] Exiting Vivado at Thu Mar 31 12:35:02 2022...

*** Running vivado
    with args -log top.vdi -applog -m64 -product Vivado -messageDb vivado.pb -mode batch -source top.tcl -notrace



****** Vivado v2020.1 (64-bit)
  **** SW Build 2902540 on Wed May 27 19:54:49 MDT 2020
  **** IP Build 2902112 on Wed May 27 22:43:36 MDT 2020
    ** Copyright 1986-2020 Xilinx, Inc. All Rights Reserved.

source top.tcl -notrace
Command: open_checkpoint top_routed.dcp

Starting open_checkpoint Task

Time (s): cpu = 00:00:00 ; elapsed = 00:00:00.037 . Memory (MB): peak = 1021.973 ; gain = 0.000
INFO: [Device 21-403] Loading part xc7a50ticsg324-1L
Netlist sorting complete. Time (s): cpu = 00:00:00 ; elapsed = 00:00:00 . Memory (MB): peak = 1021.973 ; gain = 0.000
INFO: [Netlist 29-17] Analyzing 9 Unisim elements for replacement
INFO: [Netlist 29-28] Unisim Transformation completed in 0 CPU seconds
INFO: [Project 1-479] Netlist was created with Vivado 2020.1
INFO: [Project 1-570] Preparing netlist for logic optimization
INFO: [Timing 38-478] Restoring timing data from binary archive.
INFO: [Timing 38-479] Binary timing data restore complete.
INFO: [Project 1-856] Restoring constraints from binary archive.
INFO: [Project 1-853] Binary constraint restore complete.
Reading XDEF placement.
Reading placer database...
Reading XDEF routing.
Read XDEF File: Time (s): cpu = 00:00:00 ; elapsed = 00:00:00.089 . Memory (MB): peak = 1266.973 ; gain = 6.941
Restored from archive | CPU: 0.000000 secs | Memory: 0.000000 MB |
Finished XDEF File Restore: Time (s): cpu = 00:00:00 ; elapsed = 00:00:00.090 . Memory (MB): peak = 1266.973 ; gain = 6.941
Netlist sorting complete. Time (s): cpu = 00:00:00 ; elapsed = 00:00:00 . Memory (MB): peak = 1266.973 ; gain = 0.000
INFO: [Project 1-111] Unisim Transformation Summary:
No Unisim elements were transformed.

INFO: [Project 1-604] Checkpoint was created with Vivado v2020.1 (64-bit) build 2902540
open_checkpoint: Time (s): cpu = 00:00:14 ; elapsed = 00:00:15 . Memory (MB): peak = 1266.973 ; gain = 245.000
Command: write_bitstream -force top.bit
Attempting to get a license for feature 'Implementation' and/or device 'xc7a50ti'
INFO: [Common 17-349] Got license for feature 'Implementation' and/or device 'xc7a50ti'
Running DRC as a precondition to command write_bitstream
INFO: [IP_Flow 19-234] Refreshing IP repositories
INFO: [IP_Flow 19-1704] No user IP repositories specified
INFO: [IP_Flow 19-2313] Loaded Vivado IP repository 'C:/APPZ/Xilinx/Vivado/2020.1/data/ip'.
INFO: [DRC 23-27] Running DRC with 2 threads
WARNING: [DRC CFGBVS-1] Missing CFGBVS and CONFIG_VOLTAGE Design Properties: Neither the CFGBVS nor CONFIG_VOLTAGE voltage property is set in the current_design.  Configuration bank voltage select (CFGBVS) must be set to VCCO or GND, and CONFIG_VOLTAGE must be set to the correct configuration voltage, in order to determine the I/O voltage support for the pins in bank 0.  It is suggested to specify these either using the 'Edit Device Properties' function in the GUI or directly in the XDC file using the following syntax:

 set_property CFGBVS value1 [current_design]
 #where value1 is either VCCO or GND

 set_property CONFIG_VOLTAGE value2 [current_design]
 #where value2 is the voltage provided to configuration bank 0

Refer to the device configuration user guide for more information.
INFO: [Vivado 12-3199] DRC finished with 0 Errors, 1 Warnings
INFO: [Vivado 12-3200] Please refer to the DRC report (report_drc) for more information.
INFO: [Designutils 20-2272] Running write_bitstream with 2 threads.
Loading data files...
Loading site data...
Loading route data...
Processing options...
Creating bitmap...
Creating bitstream...
Writing bitstream ./top.bit...
INFO: [Vivado 12-1842] Bitgen Completed Successfully.
INFO: [Project 1-120] WebTalk data collection is mandatory when using a WebPACK part without a full Vivado license. To see the specific WebTalk data collected for your design, open the usage_statistics_webtalk.html or usage_statistics_webtalk.xml file in the implementation directory.
Pý¡stup byl odepýen.
Pý¡stup byl odepýen.
INFO: [Common 17-83] Releasing license: Implementation
22 Infos, 1 Warnings, 0 Critical Warnings and 0 Errors encountered.
write_bitstream completed successfully
write_bitstream: Time (s): cpu = 00:00:11 ; elapsed = 00:00:10 . Memory (MB): peak = 1729.555 ; gain = 462.582
INFO: [Common 17-206] Exiting Vivado at Thu Mar 31 12:39:33 2022...
